{
  "schema_version": "dpl/v1",
  "policy_version": "activation-inspection-policy/v1",
  "read_only": true,
  "repository": {
    "absolute_path": "/Users/example/AIControlCenter",
    "branch": "fixture/activation-inspection",
    "expected_head": "aaaaaaaaaaaaaaaaaaaaaaaaaaaaaaaaaaaaaaaa",
    "require_clean_worktree": true,
    "require_remote_sync": true
  },
  "runtime": {
    "root": "/Users/example/Library/Application Support/AIControlCenter/runtime",
    "current_link_name": "current",
    "expected_current_runtime": "111111111111",
    "candidate_runtime": "222222222222",
    "expected_source_commit": "bbbbbbbbbbbbbbbbbbbbbbbbbbbbbbbbbbbbbbbb",
    "metadata_filename": "runtime-metadata.json",
    "source_marker_filename": ".aicontrolcenter-source-commit",
    "python": {
      "executable_relative_path": "bin/python",
      "probe_arguments": [
        "-I",
        "-S",
        "--version"
      ],
      "inherit_pythonpath": false,
      "user_site_enabled": false,
      "bytecode_writes": false,
      "dependency_identity_source": "RUNTIME_METADATA"
    }
  },
  "application": {
    "serving_target": "core.api.shadow:app"
  },
  "launchd": {
    "domain": "system",
    "label": "com.aicontrolcenter.api.shadow",
    "identity": "system/com.aicontrolcenter.api.shadow",
    "allowed_operation": "print",
    "application_user": "fixture-user"
  },
  "listener": {
    "host": "127.0.0.1",
    "port": 18100,
    "expected_listener_count": 1,
    "require_pid_match": true,
    "loopback_only": true
  },
  "route_manifest": {
    "manifest_version": "activation-route-manifest/v1",
    "manifest_digest": "sha256:3e875a5aa8051eacd2a4a3ddc828414f044568c082723849a312feb74949eb0a"
  },
  "safety": {
    "runtime_mutations": 0,
    "service_restarts": 0,
    "rollback_executions": 0,
    "launchd_changes": 0,
    "caddy_changes": 0,
    "public_openings": 0,
    "production_writes": 0,
    "ubuntu_changes": 0,
    "production_authorized": false
  }
}
